{
  "companyName": "ELLAH LAKES PLC",
  "rcNumber": null,
  "reportTitle": "UNAUDITED FINANCIAL STATEMENTS",
  "consolidationLevel": null,
  "statementType": null,
  "financialPeriodLabel": "FOR SIX MONTHS ENDED",
  "periodStart": null,
  "periodEnd": "2019-01-31",
  "periodLengthMonths": 6,
  "fiscalYear": 2019,
  "auditedStatus": "unaudited",
  "currency": "NGN",
  "chunkPage": 1,
  "topics": [],
  "keyFigures": {
    "totalAssets": null,
    "totalLiabilities": null,
    "totalEquity": null,
    "revenue": null,
    "costOfSales": null,
    "grossProfit": null,
    "operatingProfitLoss": null,
    "netProfit": null,
    "eps": null,
    "cashAndCashEquivalents": null,
    "cashAtBank": null,
    "biologicalAssets": null,
    "propertyPlantEquipment": null,
    "borrowings": null,
    "retainedEarnings": null,
    "shareCapital": null,
    "sharePremium": null,
    "revaluationSurplus": null
  },
  "detailed_summary": "**ELLAH LAKES PLC - UNAUDITED FINANCIAL STATEMENTS SUMMARY FOR SIX MONTHS ENDED 31 JANUARY 2019**\n\n- **Certification**: The directors certify the financial statements under Section 60 (2) of the Investment and Securities Act (ISA), 2007, confirming the report's accuracy and completeness.\n\n- **Statement Types**:\n  - **Statement of Financial Position**: Details on assets, liabilities, and equity.\n  - **Statement of Profit or Loss**: Revenue, expenses, and profit/loss figures.\n  - **Statement of Changes in Equity**: Changes in equity during the period.\n  - **Statement of Cash Flows**: Cash inflows and outflows.\n  - **Notes to Financial Statements**: Additional disclosures and explanations.\n\n- **Key Financial Figures**: \n  - **Period**: Six months ended 31 January 2019.\n  - **Currency**: Not specified in the provided text.\n\n- **Management Responsibilities**: The directors are responsible for internal controls, ensuring material information is disclosed, and evaluating the effectiveness of these controls.\n\n- **Audit Committee Interaction**: The directors have communicated any significant deficiencies in internal controls and any fraud involving management or employees.\n\n- **Certification Date**: 19 February 2019, by Mr. Chuka Mordi (Executive Director) and Mr. Joel Omole (Finance Manager).\n\nThis summary encapsulates the essential financial reporting elements and management assertions for Ellah Lakes PLC for the specified period."
}