{
  "doc_id": "31279_ELLAH_LAKES_PLC.-IMC_ACQUISITION_UPDATE_CORPORATE_ACTI",
  "source_file": "C:\\Users\\umair\\Desktop\\Financial Rag\\dataset\\Corporate_Disclosures\\31279_ELLAH_LAKES_PLC.-IMC_ACQUISITION_UPDATE_CORPORATE_ACTI.pdf",
  "title": "Ellah Lakes Plc & Plantations Acquisition - update",
  "doc_type": "corporate_action",
  "disclosure_date": "2020-08-19",
  "year": 2020,
  "company_name": "Ellah Lakes Plc",
  "rc_number": null,
  "head_office_address": "No. 12 Ihama Road, G.R.A, Benin City, Edo State",
  "website": "www.ellahlakes.com",
  "meeting_type": null,
  "meeting_date": null,
  "meeting_time": null,
  "meeting_location": null,
  "agenda_items": [],
  "register_closure_start": null,
  "register_closure_end": null,
  "closed_period_start": null,
  "closed_period_end": null,
  "directors_as_listed": [
    "Olu Akpata",
    "Frank Ellah",
    "Chuka Mordi",
    "Shehu Abubakar",
    "Osaro Oyegun",
    "Gbubemi Jakpa",
    "Maxwell Oko",
    "Nnenna Onyewuchi",
    "Enotie Ogbebor",
    "Chijioke Dozie",
    "Hauwa Nuru",
    "Joe Attueyi"
  ],
  "key_people_events": [],
  "company_secretary": "OAKE Legal",
  "signatory_name": null,
  "event_category": "acquisition",
  "transaction_type": null,
  "transaction_amount": null,
  "currency": null,
  "counterparties": [],
  "regulatory_bodies": [],
  "regulatory_references": [],
  "pages": [
    1
  ],
  "citation_file": null,
  "detailed_summary": "### Summary of Corporate Disclosure Document\n\n#### Purpose and Nature of the Disclosure\nThe document serves as an update from Ellah Lakes Plc regarding a potential acquisition transaction. It informs shareholders and the market about the company's engagement in exclusive discussions for the purchase of a significant asset, specifically an oil palm processing company.\n\n#### Key Dates\n- **Date of Disclosure:** 19 August 2020\n\n#### Key Parties Involved\n- **Company:** Ellah Lakes Plc\n- **Directors of Ellah Lakes Plc:**\n  - Olu Akpata\n  - Frank Ellah\n  - Chuka Mordi\n  - Shehu Abubakar\n  - Osaro Oyegun\n  - Gbubemi Jakpa\n  - Maxwell Oko\n  - Nnenna Onyewuchi\n  - Enotie Ogbebor\n  - Chijioke Dozie\n  - Hauwa Nuru\n  - Joe Attueyi\n- **Legal Representation:** OAKE Legal (Company Secretary)\n\n#### Transaction Details\n- **Nature of Transaction:** Potential acquisition of 100% of the shares of an oil palm processing company.\n- **Location of Assets:** Delta State, Nigeria.\n- **Status of Transaction:** A binding term sheet has been agreed upon, but the completion is contingent upon:\n  - Regulatory approvals\n  - Execution of a definitive agreement\n\n#### Regulatory and Compliance Matters\n- The completion of the transaction is subject to regulatory approvals, indicating compliance with relevant legal and regulatory frameworks.\n- Ellah Lakes Plc commits to updating the market in accordance with its disclosure obligations.\n\n#### Shareholder Advisory\n- Shareholders are advised to exercise caution when trading in the securities of Ellah Lakes Plc until a full announcement regarding the transaction is made.\n\n#### Conclusion\nThis disclosure highlights Ellah Lakes Plc's strategic move towards expanding its operations through the acquisition of a processing company, while also emphasizing the importance of regulatory compliance and shareholder awareness during the negotiation phase."
}