{
  "doc_id": "31886_ELLAH_LAKES_PLC RESIGNATION_OF_FRANK_ELLAH_AS_A_DIREC",
  "source_file": "C:\\Users\\umair\\Desktop\\Financial Rag\\dataset\\Corporate_Disclosures\\31886_ELLAH_LAKES_PLC RESIGNATION_OF_FRANK_ELLAH_AS_A_DIREC.pdf",
  "title": "Notice of resignation of a director",
  "doc_type": "director_resignation",
  "disclosure_date": "2020-11-11",
  "year": 2020,
  "company_name": "Ellah Lakes Plc",
  "rc_number": "34296",
  "head_office_address": "No. 12 Ihama Road, G.R.A, Benin City, Edo State",
  "website": "www.ellahlakes.com",
  "meeting_type": null,
  "meeting_date": null,
  "meeting_time": null,
  "meeting_location": null,
  "agenda_items": [],
  "register_closure_start": null,
  "register_closure_end": null,
  "closed_period_start": null,
  "closed_period_end": null,
  "directors_as_listed": [
    "Olu Akpata",
    "Frank Ellah",
    "Chuka Mordi",
    "Shehu Abubakar",
    "Osaro Oyegun",
    "Gbubemi Jakpa",
    "Maxwell Oko",
    "Nnenna Onyewuchi",
    "Enotie Ogbebor",
    "Chijioke Dozie",
    "Hauwa Nuru",
    "Joe Attueyi"
  ],
  "key_people_events": [
    {
      "name": "Frank Ellah",
      "event": "resignation",
      "role": "Director",
      "effective_date": "2020-11-06"
    }
  ],
  "company_secretary": "OAKE Legal",
  "signatory_name": null,
  "event_category": "resignation",
  "transaction_type": null,
  "transaction_amount": null,
  "currency": null,
  "counterparties": [],
  "regulatory_bodies": [],
  "regulatory_references": [],
  "pages": [
    1
  ],
  "citation_file": null,
  "detailed_summary": "### Summary of Corporate Disclosure Document\n\n#### Purpose and Nature of the Disclosure\nThe document serves as a formal announcement regarding the resignation of a director from Ellah Lakes Plc. It is intended to inform stakeholders about the change in the board's composition.\n\n#### Key Dates\n- **Announcement Date:** November 11, 2020\n- **Effective Resignation Date:** November 6, 2020\n\n#### Key Individuals\n- **Mr. Frank Ellah:** Resigned as a director of Ellah Lakes Plc.\n- **Olu Akpata, Chuka Mordi, Shehu Abubakar, Osaro Oyegun, Gbubemi Jakpa, Maxwell Oko, Nnenna Onyewuchi, Enotie Ogbebor, Chijioke Dozie, Hauwa Nuru, Joe Attueyi:** Members of the Board of Directors of Ellah Lakes Plc.\n- **OAKE Legal:** Company Secretary responsible for the communication of the resignation.\n\n#### Company Information\n- **Company Name:** Ellah Lakes Plc\n- **Registration Number (RC):** 34296\n- **Head Office Address:** No. 12 Ihama Road, G.R.A, Benin City, Edo State\n- **Website:** www.ellahlakes.com\n- **Email:** info@ellahlakes.com\n\n#### Transactions, Events, or Decisions Described\n- The document details the resignation of Mr. Frank Ellah from the board of directors, effective November 6, 2020. The board and management express gratitude for his service to the company.\n\n#### Resolutions or Action Points\n- No specific resolutions or action points are outlined in the document beyond the acknowledgment of Mr. Frank Ellah's resignation.\n\n#### Regulatory Requirements or Compliance Matters\n- The announcement complies with corporate governance practices by formally notifying stakeholders of changes in the board of directors.\n\n#### Conclusion\nThe document is a concise notification of a significant change within the board of directors of Ellah Lakes Plc, highlighting the resignation of Mr. Frank Ellah and expressing appreciation for his contributions to the company."
}