{
  "doc_id": "32034_ELLAH_LAKES_PLC ELLAH_LAKES_PLC_ _RESOLUTIONS_PASSED",
  "source_file": "C:\\Users\\umair\\Desktop\\Financial Rag\\dataset\\Corporate_Disclosures\\32034_ELLAH_LAKES_PLC ELLAH_LAKES_PLC_ _RESOLUTIONS_PASSED.pdf",
  "title": "Resolutions Passed at the Annual General Meeting of Ellah Lakes Plc",
  "doc_type": "agm_notice",
  "disclosure_date": "2020-12-16",
  "year": 2020,
  "company_name": "Ellah Lakes Plc",
  "rc_number": null,
  "head_office_address": "No. 12 Ihama Road, G.R.A, Benin City, Edo State",
  "website": "www.ellahlakes.com",
  "meeting_type": "agm",
  "meeting_date": "2020-12-11",
  "meeting_time": null,
  "meeting_location": "Workstation, 7, Ibiyinka Olorunbe Close, Victoria Island, Lagos",
  "agenda_items": [
    "That the Company’s audited financial statements for the year ended 31 July, 2020 together with the reports of the Directors, Auditors and Audit Committee be and are hereby received and accepted",
    "That the re-election of the retiring directors by a single resolution be and is hereby approved",
    "That the re-election of Mr. Shehu Abubakar, Mrs. Hauwa Nuru and Mr. Enotie Ogbebor who are retiring by rotation and have offered themselves up for re-election be and is hereby approved",
    "That Mr. Charles Anajemba be and is hereby elected as a director of the Company",
    "That Messrs. Olabode Akande & Co. be and are hereby appointed as the Auditor of the Company for the financial year ending 31 July 2021",
    "That the board of directors of the Company be and are hereby authorised to fix the remuneration of the Auditors.",
    "That the following persons be and are hereby elected as the shareholders’ representatives on the Statutory Audit Committee: (a) Pastor Edokpayi Wilfred; (b) Mr. Olugbosun Banji; and (c) Mr. Ezechukwu Augustine Nnaemeka."
  ],
  "register_closure_start": null,
  "register_closure_end": null,
  "closed_period_start": null,
  "closed_period_end": null,
  "directors_as_listed": [
    "Olu Akpata",
    "Frank Ellah",
    "Chuka Mordi",
    "Shehu Abubakar",
    "Osaro Oyegun",
    "Gbubemi Jakpa",
    "Maxwell Oko",
    "Nnenna Onyewuchi",
    "Enotie Ogbebor",
    "Chijioke Dozie",
    "Hauwa Nuru",
    "Joe Attueyi"
  ],
  "key_people_events": [
    {
      "name": "Shehu Abubakar",
      "event": "continuing",
      "role": "Director",
      "effective_date": null
    },
    {
      "name": "Hauwa Nuru",
      "event": "continuing",
      "role": "Director",
      "effective_date": null
    },
    {
      "name": "Enotie Ogbebor",
      "event": "continuing",
      "role": "Director",
      "effective_date": null
    },
    {
      "name": "Charles Anajemba",
      "event": "appointment",
      "role": "Director",
      "effective_date": null
    },
    {
      "name": "Pastor Edokpayi Wilfred",
      "event": "appointment",
      "role": "Shareholder Representative",
      "effective_date": null
    },
    {
      "name": "Mr. Olugbosun Banji",
      "event": "appointment",
      "role": "Shareholder Representative",
      "effective_date": null
    },
    {
      "name": "Mr. Ezechukwu Augustine Nnaemeka",
      "event": "appointment",
      "role": "Shareholder Representative",
      "effective_date": null
    }
  ],
  "company_secretary": null,
  "signatory_name": null,
  "event_category": "governance",
  "transaction_type": null,
  "transaction_amount": null,
  "currency": null,
  "counterparties": [
    "Messrs. Olabode Akande & Co."
  ],
  "regulatory_bodies": [],
  "regulatory_references": [],
  "pages": [
    1
  ],
  "citation_file": null,
  "detailed_summary": "### Summary of Corporate Disclosure Document for Ellah Lakes Plc\n\n#### Purpose and Nature of the Disclosure\nThis document serves as a formal record of the resolutions passed during the Annual General Meeting (AGM) of Ellah Lakes Plc, held on December 11, 2020. It outlines the decisions made regarding the company's financial statements, director elections, auditor appointments, and the establishment of the Statutory Audit Committee.\n\n#### Key Dates\n- **Date of Meeting:** December 11, 2020\n- **Date of Document:** December 16, 2020\n- **Financial Year Ended:** July 31, 2020\n- **Next Financial Year Ending:** July 31, 2021\n\n#### Company Information\n- **Company Name:** Ellah Lakes Plc\n- **Head Office Address:** No. 12 Ihama Road, G.R.A, Benin City, Edo State\n- **Website:** www.ellahlakes.com\n\n#### Directors Mentioned\n- Olu Akpata\n- Frank Ellah\n- Chuka Mordi\n- Shehu Abubakar\n- Osaro Oyegun\n- Gbubemi Jakpa\n- Maxwell Oko\n- Nnenna Onyewuchi\n- Enotie Ogbebor\n- Chijioke Dozie\n- Hauwa Nuru\n- Joe Attueyi\n\n#### Resolutions Passed\n1. **Acceptance of Financial Statements:** The audited financial statements for the year ended July 31, 2020, along with the reports from the Directors, Auditors, and Audit Committee, were received and accepted.\n   \n2. **Re-election of Retiring Directors:** The re-election of retiring directors was approved through a single resolution.\n\n3. **Specific Re-elections:** The re-election of the following directors was specifically approved:\n   - Mr. Shehu Abubakar\n   - Mrs. Hauwa Nuru\n   - Mr. Enotie Ogbebor\n\n4. **Election of New Director:** Mr. Charles Anajemba was elected as a new director of the Company.\n\n5. **Appointment of Auditors:** Messrs. Olabode Akande & Co. were appointed as the Auditor for the financial year ending July 31, 2021.\n\n6. **Remuneration of Auditors:** The board of directors was authorized to fix the remuneration of the Auditors.\n\n7. **Election of Statutory Audit Committee Representatives:** The following individuals were elected as shareholders’ representatives on the Statutory Audit Committee:\n   - Pastor Edokpayi Wilfred\n   - Mr. Olugbosun Banji\n   - Mr. Ezechukwu Augustine Nnaemeka\n\n#### Compliance and Regulatory Matters\nThe document reflects compliance with corporate governance requirements, including the re-election of directors and the appointment of auditors, as mandated by regulatory bodies overseeing corporate practices.\n\n#### Conclusion\nThe resolutions passed during the AGM of Ellah Lakes Plc indicate a commitment to maintaining corporate governance standards and ensuring the continuity of leadership within the company. The document serves as an official record of these decisions and the individuals involved. \n\n#### Signatory\n- **Company Secretary:** [Name not provided in the document]  \n- **For Ellah Lakes Plc**"
}