{
  "doc_id": "33049_ELLAH_LAKES_PLC _NOTICES_OF_BOARD_MEETING_(BM)_ _NOTI",
  "source_file": "C:\\Users\\umair\\Desktop\\Financial Rag\\dataset\\Corporate_Disclosures\\33049_ELLAH_LAKES_PLC _NOTICES_OF_BOARD_MEETING_(BM)_ _NOTI.pdf",
  "title": "Notice of Board Meeting",
  "doc_type": "board_meeting_notice",
  "disclosure_date": "2021-04-15",
  "year": 2021,
  "company_name": "Ellah Lakes Plc",
  "rc_number": null,
  "head_office_address": "No. 12 Ihama Road, G.R.A, Benin City, Edo State",
  "website": "www.ellahlakes.com",
  "meeting_type": "board_meeting",
  "meeting_date": "2021-04-30",
  "meeting_time": "11:00",
  "meeting_location": "5th floor, AIICO Plaza, Plot PC 12, Churchgate Street, Victoria Island, Lagos",
  "agenda_items": [
    "consider the Company’s activities"
  ],
  "register_closure_start": null,
  "register_closure_end": null,
  "closed_period_start": null,
  "closed_period_end": null,
  "directors_as_listed": [
    "Olu Akpata",
    "Chuka Mordi",
    "Shehu Abubakar",
    "Osaro Oyegun",
    "Gbubemi Jakpa",
    "Maxwell Oko",
    "Nnenna Onyewuchi",
    "Enotie Ogbebor",
    "Chijioke Dozie",
    "Hauwa Nuru",
    "Joe Attueyi",
    "Charles Anajemba"
  ],
  "key_people_events": [],
  "company_secretary": "OAKE Legal",
  "signatory_name": null,
  "event_category": "meeting",
  "transaction_type": null,
  "transaction_amount": null,
  "currency": null,
  "counterparties": [],
  "regulatory_bodies": [],
  "regulatory_references": [],
  "pages": [
    1
  ],
  "citation_file": null,
  "detailed_summary": "### Summary of Corporate Disclosure Document\n\n#### Purpose and Nature of the Disclosure\nThe document serves as a formal notice of a scheduled meeting of the Board of Directors of Ellah Lakes Plc. It outlines the date, time, and location of the meeting, as well as the agenda to consider the Company’s activities.\n\n#### Key Dates\n- **Date of Notice**: 15 April 2021\n- **Date of Board Meeting**: 30 April 2021\n- **Time of Meeting**: 11:00 AM\n\n#### Location of the Meeting\n- **Venue**: 5th floor, AIICO Plaza, Plot PC 12, Churchgate Street, Victoria Island, Lagos\n\n#### Directors Mentioned\nThe following individuals are listed as directors of Ellah Lakes Plc:\n- Olu Akpata\n- Chuka Mordi\n- Shehu Abubakar\n- Osaro Oyegun\n- Gbubemi Jakpa\n- Maxwell Oko\n- Nnenna Onyewuchi\n- Enotie Ogbebor\n- Chijioke Dozie\n- Hauwa Nuru\n- Joe Attueyi\n- Charles Anajemba\n\n#### Company Information\n- **Company Name**: Ellah Lakes Plc\n- **Head Office Address**: No. 12 Ihama Road, G.R.A, Benin City, Edo State\n- **Website**: www.ellahlakes.com\n- **Company Secretary**: OAKE Legal\n\n#### Agenda Items\nThe primary agenda item for the meeting is to consider the Company’s activities. Specific details regarding other matters to be discussed are not provided in the document.\n\n#### Compliance and Regulatory Matters\nThe notice adheres to corporate governance practices by formally notifying the Board of Directors about the meeting, which is a requirement for transparency and accountability in corporate operations.\n\n#### Conclusion\nThis document is a formal notification for a Board meeting of Ellah Lakes Plc, detailing essential information such as the date, time, location, and the directors involved, while also indicating the agenda to be discussed."
}