{
  "doc_id": "33946_ELLAH_LAKES_PLC _NOTICES_OF_BOARD_MEETING_(BM)_ _NOTI",
  "source_file": "C:\\Users\\umair\\Desktop\\Financial Rag\\dataset\\Corporate_Disclosures\\33946_ELLAH_LAKES_PLC _NOTICES_OF_BOARD_MEETING_(BM)_ _NOTI.pdf",
  "title": "Notice of Board Meeting",
  "doc_type": "board_meeting_notice",
  "disclosure_date": "2021-08-05",
  "year": 2021,
  "company_name": "Ellah Lakes Plc",
  "rc_number": null,
  "head_office_address": "No. 12 Ihama Road, G.R.A, Benin City, Edo State",
  "website": "www.ellahlakes.com",
  "meeting_type": "board_meeting",
  "meeting_date": "2021-08-17",
  "meeting_time": "11:00",
  "meeting_location": "5th floor, AIICO Plaza, Plot PC 12, Churchgate Street, Victoria Island, Lagos",
  "agenda_items": [
    "Discuss the Company’s financial statements for the year ended 31 July 2021"
  ],
  "register_closure_start": "2021-08-02",
  "register_closure_end": null,
  "closed_period_start": "2021-08-02",
  "closed_period_end": null,
  "directors_as_listed": [
    "Olu Akpata",
    "Chuka Mordi",
    "Shehu Abubakar",
    "Osaro Oyegun",
    "Gbubemi Jakpa",
    "Maxwell Oko",
    "Nnenna Onyewuchi",
    "Enotie Ogbebor",
    "Chijioke Dozie",
    "Hauwa Nuru",
    "Joe Attueyi",
    "Charles Anajemba"
  ],
  "key_people_events": [],
  "company_secretary": "OAKE Legal",
  "signatory_name": null,
  "event_category": "meeting",
  "transaction_type": null,
  "transaction_amount": null,
  "currency": null,
  "counterparties": [],
  "regulatory_bodies": [
    "Nigerian Exchange Limited"
  ],
  "regulatory_references": [],
  "pages": [
    1
  ],
  "citation_file": null,
  "detailed_summary": "### Summary of Corporate Disclosure Document\n\n#### Purpose and Nature of the Disclosure\nThis document serves as a formal notice of a Board Meeting for Ellah Lakes Plc, detailing the agenda, timing, and regulatory compliance related to the meeting. It informs stakeholders about the discussion of the Company’s financial statements for the fiscal year ending July 31, 2021.\n\n#### Key Dates\n- **Board Meeting Date:** Tuesday, 17 August 2021\n- **Time of Meeting:** 11:00 AM\n- **Closed Period Commencement:** 2 August 2021\n- **Closed Period End:** 24 hours after the public announcement of the financial statements and the outcome of the Board Meeting.\n\n#### Amounts and Numerical Data\n- **Fiscal Year End Date:** 31 July 2021\n\n#### Names of Individuals and Their Roles\n- **Directors of Ellah Lakes Plc:**\n  - Olu Akpata\n  - Chuka Mordi\n  - Shehu Abubakar\n  - Osaro Oyegun\n  - Gbubemi Jakpa\n  - Maxwell Oko\n  - Nnenna Onyewuchi\n  - Enotie Ogbebor\n  - Chijioke Dozie\n  - Hauwa Nuru\n  - Joe Attueyi\n  - Charles Anajemba\n- **Company Secretary:** OAKE Legal\n\n#### Companies, Organizations, and Regulatory Bodies Referenced\n- **Company:** Ellah Lakes Plc\n- **Regulatory Body:** Nigerian Exchange Limited\n\n#### Specific Transactions, Events, or Decisions Described\nThe primary focus of the Board Meeting is to discuss the financial statements of Ellah Lakes Plc for the year ended 31 July 2021.\n\n#### Agenda Items, Resolutions, or Action Points\n- Review and discuss the financial statements for the fiscal year ending 31 July 2021.\n\n#### Regulatory Requirements or Compliance Matters\n- The document outlines the Closed Period, during which no director, employee, or person discharging managerial responsibility, along with their connected persons, may engage in any trading of the Company’s shares. This is in accordance with the Rulebook of the Nigerian Exchange Limited.\n\n#### Deadlines, Closure Periods, or Important Timeframes\n- The Closed Period is effective from 2 August 2021 until 24 hours after the financial statements and the Board Meeting outcomes are publicly disclosed.\n\n#### Conclusion\nThis notice is a formal communication to stakeholders regarding the upcoming Board Meeting of Ellah Lakes Plc, emphasizing compliance with regulatory requirements and the importance of the financial statements discussion."
}