{
  "doc_id": "33962_ELLAH_LAKES_PLC ELLAH_LAKES_PLC_APPOINTS_MR_ROBERT_G",
  "source_file": "C:\\Users\\umair\\Desktop\\Financial Rag\\dataset\\Corporate_Disclosures\\33962_ELLAH_LAKES_PLC ELLAH_LAKES_PLC_APPOINTS_MR_ROBERT_G.pdf",
  "title": "Ellah Lakes Plc Appoints Mr. Robert Grant as Chief Financial Officer",
  "doc_type": "director_appointment",
  "disclosure_date": "2021-08-09",
  "year": 2021,
  "company_name": "Ellah Lakes Plc",
  "rc_number": "34296",
  "head_office_address": "No. 12 Ihama Road, G.R.A, Benin City, Edo State",
  "website": "www.ellahlakes.com",
  "meeting_type": null,
  "meeting_date": null,
  "meeting_time": null,
  "meeting_location": null,
  "agenda_items": [],
  "register_closure_start": null,
  "register_closure_end": null,
  "closed_period_start": null,
  "closed_period_end": null,
  "directors_as_listed": [
    "Olu Akpata",
    "Frank Ellah",
    "Chuka Mordi",
    "Shehu Abubakar",
    "Osaro Oyegun",
    "Gbubemi Jakpa",
    "Maxwell Oko",
    "Nnenna Onyewuchi",
    "Enotie Ogbebor",
    "Chijioke Dozie",
    "Hauwa Nuru",
    "Joe Attueyi",
    "Charles Anajemba"
  ],
  "key_people_events": [
    {
      "name": "Robert Grant",
      "event": "appointment",
      "role": "Chief Financial Officer",
      "effective_date": "2021-09-01"
    },
    {
      "name": "Chuka Mordi",
      "event": "continuing",
      "role": "Chief Executive Officer/Managing Director",
      "effective_date": null
    }
  ],
  "company_secretary": "OAKE LEGAL",
  "signatory_name": "Chuka Mordi",
  "event_category": "appointment",
  "transaction_type": null,
  "transaction_amount": null,
  "currency": null,
  "counterparties": [
    "First City Monument Bank",
    "Ghana Telecom"
  ],
  "regulatory_bodies": [
    "Nigerian Exchange Limited"
  ],
  "regulatory_references": [],
  "pages": [
    1
  ],
  "citation_file": null,
  "detailed_summary": "### Summary of Corporate Disclosure Document for Ellah Lakes Plc\n\n#### Purpose and Nature of the Disclosure\nThis document serves as a press release announcing the appointment of Mr. Robert Grant as the Chief Financial Officer (CFO) of Ellah Lakes Plc. It provides details about the new appointment, the background of the appointee, and a brief overview of the company’s recent transformation and focus.\n\n#### Key Dates\n- **Announcement Date:** 9 August 2021\n- **Effective Date of Appointment:** 1 September 2021\n\n#### Key Personnel\n- **Mr. Robert Grant:** Appointed as Chief Financial Officer (CFO) of Ellah Lakes Plc. He is currently the Head of Infrastructure Financing at First City Monument Bank and has previously served as the CFO of Ghana Telecom. He holds an MBA from the NYU Stern School.\n- **Mr. Chuka Mordi:** Chief Executive Officer/Managing Director of Ellah Lakes Plc, who commented on the appointment.\n\n#### Company Information\n- **Company Name:** Ellah Lakes Plc\n- **Founded:** 1980\n- **Listing:** Main Board of the Nigerian Exchange\n- **Recent Acquisition:** In 2019, the company was acquired by new shareholders and has since transformed its operations.\n- **Current Operations:** Focus on oil palm production, cassava farming, maize, soya bean, and their derivative products.\n- **Acquisition of Telluria Farms:** Completed in May 2019, which repositioned the company’s focus towards agribusiness.\n\n#### Company Directors\nThe document lists the following directors of Ellah Lakes Plc:\n- Olu Akpata\n- Frank Ellah\n- Chuka Mordi\n- Shehu Abubakar\n- Osaro Oyegun\n- Gbubemi Jakpa\n- Maxwell Oko\n- Nnenna Onyewuchi\n- Enotie Ogbebor\n- Chijioke Dozie\n- Hauwa Nuru\n- Joe Attueyi\n- Charles Anajemba\n\n#### Regulatory and Compliance Matters\nThe information provided is categorized as non-regulated, indicating that it does not fall under mandatory regulatory disclosure requirements.\n\n#### Additional Information\n- **Company Secretary:** OAKE LEGAL\n- **Head Office Address:** No. 12 Ihama Road, G.R.A, Benin City, Edo State\n- **Registration Number:** Rc Number: 34296\n- **Website:** www.ellahlakes.com\n\nThis summary encapsulates all significant details from the corporate disclosure document regarding the appointment of Mr. Robert Grant and the operational focus of Ellah Lakes Plc."
}