{
  "doc_id": "36117_ELLAH_LAKES_PLC RESOLUTION_PASSED_AT_THE_EXTRAORDINAR",
  "source_file": "C:\\Users\\umair\\Desktop\\Financial Rag\\dataset\\Corporate_Disclosures\\36117_ELLAH_LAKES_PLC RESOLUTION_PASSED_AT_THE_EXTRAORDINAR.pdf",
  "title": "Resolution Passed at the Extraordinary General Meeting",
  "doc_type": "egm_notice",
  "disclosure_date": "2022-05-26",
  "year": 2022,
  "company_name": "Ellah Lakes Plc",
  "rc_number": null,
  "head_office_address": "No. 12 Ihama Road, G.R.A, Benin City, Edo State",
  "website": "www.ellahlakes.com",
  "meeting_type": "egm",
  "meeting_date": "2022-05-26",
  "meeting_time": null,
  "meeting_location": "Workstation, 7, Ibiyinka Olorunbe Close, Victoria Island, Lagos",
  "agenda_items": [
    "That the directors be and are hereby authorised to raise additional capital whether by way of debt, equity, or a mixture of both, or via public offering, private placement or right issue in such tranches, series or proportions and such prices or interest rates, within such maturity periods, at such dates and time and on such terms and conditions as may be determined by the directors, subject to the requisite approval of the relevant regulatory authorities."
  ],
  "register_closure_start": null,
  "register_closure_end": null,
  "closed_period_start": null,
  "closed_period_end": null,
  "directors_as_listed": [
    "Olu Akpata",
    "Chuka Mordi",
    "Shehu Abubakar",
    "Osaro Oyegun",
    "Evans Jakpa-Johns",
    "Maxwell Oko",
    "Nnenna Onyewuchi",
    "Enotie Ogbebor",
    "Chijioke Dozie",
    "Hauwa Nuru",
    "Joe Attueyi",
    "Charles Anajemba"
  ],
  "key_people_events": [],
  "company_secretary": null,
  "signatory_name": null,
  "event_category": "governance",
  "transaction_type": null,
  "transaction_amount": null,
  "currency": null,
  "counterparties": [],
  "regulatory_bodies": [],
  "regulatory_references": [],
  "pages": [
    1
  ],
  "citation_file": null,
  "detailed_summary": "### Summary of Corporate Disclosure Document for Ellah Lakes Plc\n\n#### Purpose and Nature of the Disclosure\nThis document serves as a formal record of the resolutions passed during the Extraordinary General Meeting (EGM) of Ellah Lakes Plc, held on May 26, 2022. The primary purpose of the meeting was to authorize the directors to raise additional capital for the company.\n\n#### Key Dates\n- **Date of Meeting:** May 26, 2022\n- **Location of Meeting:** Workstation, 7, Ibiyinka Olorunbe Close, Victoria Island, Lagos\n\n#### Key Resolutions\n- The resolution passed at the EGM authorizes the directors of Ellah Lakes Plc to raise additional capital through various means, including:\n  - Debt\n  - Equity\n  - A mixture of both\n  - Public offering\n  - Private placement\n  - Rights issue\n- The directors are empowered to determine the specifics of the capital raise, including:\n  - Tranches, series, or proportions\n  - Prices or interest rates\n  - Maturity periods\n  - Dates and times\n  - Terms and conditions\n- The capital raise is subject to the requisite approval from relevant regulatory authorities.\n\n#### Directors of Ellah Lakes Plc\nThe following individuals are listed as directors of the company:\n- Olu Akpata\n- Chuka Mordi\n- Shehu Abubakar\n- Osaro Oyegun\n- Evans Jakpa-Johns\n- Maxwell Oko\n- Nnenna Onyewuchi\n- Enotie Ogbebor\n- Chijioke Dozie\n- Hauwa Nuru\n- Joe Attueyi\n- Charles Anajemba\n\n#### Company Information\n- **Head Office Address:** No. 12 Ihama Road, G.R.A, Benin City, Edo State\n- **Website:** [www.ellahlakes.com](http://www.ellahlakes.com)\n- **Investors’ Relations Officer Contact:** \n  - Email: geraldine.ofoluwa@ellahlakes.com\n  - Telephone: +2348180433479\n\n#### Regulatory Compliance\nThe resolution to raise additional capital is contingent upon obtaining the necessary approvals from relevant regulatory authorities, ensuring compliance with applicable regulations.\n\n#### Additional Notes\n- The document includes a statement regarding the company's commitment to investor relations, highlighting the availability of a dedicated investors’ portal on the corporate website.\n\n#### Conclusion\nThe EGM of Ellah Lakes Plc on May 26, 2022, resulted in a significant resolution empowering the directors to pursue various avenues for raising additional capital, thereby positioning the company for potential growth and investment opportunities."
}