{
  "doc_id": "36609_ELLAH_LAKES_PLC PRESS_RELEASE_ON_THE_APPOINTMENT_OF_N",
  "source_file": "C:\\Users\\umair\\Desktop\\Financial Rag\\dataset\\Corporate_Disclosures\\36609_ELLAH_LAKES_PLC PRESS_RELEASE_ON_THE_APPOINTMENT_OF_N.pdf",
  "title": "Appointment of Paul Farrer as Deputy Managing Director",
  "doc_type": "director_appointment",
  "disclosure_date": "2022-08-01",
  "year": 2022,
  "company_name": "Ellah Lakes Plc",
  "rc_number": null,
  "head_office_address": "No. 12 Ihama Road, G.R.A, Benin City, Edo State",
  "website": "www.ellahlakes.com",
  "meeting_type": null,
  "meeting_date": null,
  "meeting_time": null,
  "meeting_location": null,
  "agenda_items": [],
  "register_closure_start": null,
  "register_closure_end": null,
  "closed_period_start": null,
  "closed_period_end": null,
  "directors_as_listed": [
    "Olu Akpata",
    "Chuka Mordi",
    "Shehu Abubakar",
    "Osaro Oyegun",
    "Evans Jakpa-Johns",
    "Maxwell Oko",
    "Nnenna Onyewuchi",
    "Enotie Ogbebor",
    "Chijioke Dozie",
    "Hauwa Nuru",
    "Joe Attueyi",
    "Charles Anajemba"
  ],
  "key_people_events": [
    {
      "name": "Paul Farrer",
      "event": "appointment",
      "role": "Deputy Managing Director",
      "effective_date": "2022-08-01"
    },
    {
      "name": "Chuka Mordi",
      "event": "continuing",
      "role": "Chief Executive Officer",
      "effective_date": null
    }
  ],
  "company_secretary": "OAKE Legal",
  "signatory_name": "Olumoroti Alli",
  "event_category": "appointment",
  "transaction_type": null,
  "transaction_amount": null,
  "currency": null,
  "counterparties": [
    "Innscor International",
    "Food Concepts Plc",
    "Nascon Allied Industries PLC"
  ],
  "regulatory_bodies": [
    "Nigerian Exchange Limited"
  ],
  "regulatory_references": [],
  "pages": [
    1
  ],
  "citation_file": null,
  "detailed_summary": "### Summary of Corporate Disclosure Document for Ellah Lakes Plc.\n\n#### Purpose and Nature of the Disclosure\nThis document serves as an official announcement regarding the appointment of a new Deputy Managing Director at Ellah Lakes Plc. It outlines the background of the appointee, Mr. Paul Farrer, and his role within the company, as well as comments from the Chief Executive Officer.\n\n#### Key Dates\n- **Announcement Date**: August 1, 2022\n- **Listing Date on Nigerian Exchange Limited**: January 14, 1993\n\n#### Key Personnel\n- **New Deputy Managing Director**: Mr. Paul Farrer\n- **Chief Executive Officer**: Chuka Mordi\n- **Company Secretary**: Olumoroti Alli\n- **Board of Directors**: \n  - Olu Akpata\n  - Chuka Mordi\n  - Shehu Abubakar\n  - Osaro Oyegun\n  - Evans Jakpa-Johns\n  - Maxwell Oko\n  - Nnenna Onyewuchi\n  - Enotie Ogbebor\n  - Chijioke Dozie\n  - Hauwa Nuru\n  - Joe Attueyi\n  - Charles Anajemba\n\n#### Background of Mr. Paul Farrer\n- **Previous Roles**:\n  - Country Manager for Innscor International\n  - Group Executive Director & Chief Operating Officer of Food Concepts Plc\n  - CEO of Nascon Allied Industries Plc for the last seven years, managing over 600 staff.\n- **Industry Experience**: Extensive experience in the Nigerian private sector and a proven track record in operational leadership.\n\n#### Responsibilities\nMr. Farrer will focus on:\n- Operational growth and development of Ellah Lakes Plc.\n- Expansion of the Ellah Lakes Staple Crop Processing Zones (SCPZ's) strategy across Nigeria.\n\n#### CEO's Comments\nChuka Mordi expressed enthusiasm about Mr. Farrer’s appointment, highlighting:\n- The value he brings to the team.\n- His proven track record in both international and Nigerian contexts.\n- The ambitious growth targets set for Ellah Lakes Plc and Mr. Farrer’s capability to navigate the challenging Nigerian environment.\n\n#### Company Overview\n- **Company Name**: Ellah Lakes Plc.\n- **Industry**: Agribusiness specializing in the cultivation of Oil Palm, Cassava, and Soya beans.\n- **Operational States**: Edo, Enugu, and Ondo States.\n- **Community Impact**: The company has contributed to the empowerment of local communities and is diversifying its operations across various agricultural value chains, including Maize and Rice.\n\n#### Contact Information\n- **Website**: www.ellahlakes.com\n\n#### Conclusion\nThe document concludes with a formal signature from Olumoroti Alli, representing OAKE Legal as the Company Secretary, affirming the authenticity of the announcement. \n\nThis summary encapsulates all significant details from the corporate disclosure document regarding the appointment of Mr. Paul Farrer and the operational context of Ellah Lakes Plc."
}