{
  "doc_id": "36736_ELLAH_LAKES_PLC TAKE OVER_OF_THE_MANAGEMENT_AND_OPERA",
  "source_file": "C:\\Users\\umair\\Desktop\\Financial Rag\\dataset\\Corporate_Disclosures\\36736_ELLAH_LAKES_PLC TAKE OVER_OF_THE_MANAGEMENT_AND_OPERA.pdf",
  "title": "Take Over of The Management and Operations of Adarice Farms",
  "doc_type": "corporate_action",
  "disclosure_date": "2022-09-08",
  "year": 2022,
  "company_name": "Ellah Lakes Plc",
  "rc_number": null,
  "head_office_address": "No. 12 Ihama Road, G.R.A, Benin City, Edo State",
  "website": "www.ellahlakes.com",
  "meeting_type": null,
  "meeting_date": null,
  "meeting_time": null,
  "meeting_location": null,
  "agenda_items": [],
  "register_closure_start": null,
  "register_closure_end": null,
  "closed_period_start": null,
  "closed_period_end": null,
  "directors_as_listed": [
    "Olu Akpata",
    "Chu ka M ordi",
    "Shehu Abubakar",
    "Osaro Oyegun",
    "Evans Jakpa-Johns",
    "Maxwell Oko",
    "Nnenna Onyewuchi",
    "Enotie Ogbebor",
    "Chijioke Dozie",
    "Hauwa Nuru",
    "Joe Attueyi",
    "Charles Anajemba"
  ],
  "key_people_events": [
    {
      "name": "Chuka Mordi",
      "event": "announcement_subject",
      "role": "Chief Executive Officer",
      "effective_date": null
    }
  ],
  "company_secretary": "OAKE Legal",
  "signatory_name": null,
  "event_category": "governance",
  "transaction_type": null,
  "transaction_amount": null,
  "currency": null,
  "counterparties": [
    "Enugu State Government",
    "Adani Staple Crop Processing Zone Food Company"
  ],
  "regulatory_bodies": [],
  "regulatory_references": [],
  "pages": [
    1
  ],
  "citation_file": null,
  "detailed_summary": "### Summary of Corporate Disclosure Document for Ellah Lakes Plc\n\n#### Purpose and Nature of the Disclosure\nThis document serves as a corporate announcement by Ellah Lakes Plc regarding the takeover of management and operations of Adarice Farms and associated assets from the Enugu State Government. The announcement follows the signing of a Memorandum of Understanding (MoU) between Ellah Lakes Plc and the Enugu State Technical Committee on Privatisation and Commercialisation.\n\n#### Key Dates\n- **Announcement Date:** September 8, 2022\n- **MoU Signing Date:** Not specified in the document, but it precedes the announcement.\n\n#### Key Amounts and Numerical Data\n- **Size of Adarice Farms:** 5,000 hectares\n- **Irrigation Infrastructure:** Includes a diversion dam and a 15 km main canal, along with secondary distribution canals.\n\n#### Individuals Mentioned\n- **Chuka Mordi:** Chief Executive Officer of Ellah Lakes Plc, who commented on the development.\n- **Olu Akpata, Chuka Mordi, Shehu Abubakar, Osaro Oyegun, Evans Jakpa-Johns, Maxwell Oko, Nnenna Onyewuchi, Enotie Ogbebor, Chijioke Dozie, Hauwa Nuru, Joe Attueyi, Charles Anajemba:** Directors of Ellah Lakes Plc.\n\n#### Companies and Organizations Referenced\n- **Ellah Lakes Plc:** The company making the announcement.\n- **Adarice Farms:** The farming estate being taken over.\n- **Enugu State Government:** The government entity from which the management of Adarice Farms is being taken over.\n- **Adani Staple Crop Processing Zone Food Company (Adani SCPZ):** A Special Purpose Vehicle (SPV) established to manage the farm and its activities.\n\n#### Specific Transactions and Events\n- **Takeover of Management:** Ellah Lakes Plc has officially taken over the management and operations of Adarice Farms, which has been underperforming for several years.\n- **Establishment of SPV:** The Adani SCPZ has been set up to oversee the management of Adarice Farms.\n\n#### Statements and Future Plans\n- **CEO's Statement:** Chuka Mordi expressed optimism about the takeover, stating it marks a significant milestone for the company in 2022. He emphasized the intention to enhance the management and productivity of Adarice Farms, focusing on the cultivation and processing of rice, soybean, and cassava. The ultimate goal is to transform the area into a Staple Crop Processing Zone, fostering economic growth and prosperity in the sub-region.\n\n#### Regulatory Requirements and Compliance Matters\n- The announcement indicates compliance with the necessary regulatory framework by disclosing the MoU with the Enugu State Government and the establishment of the SPV.\n\n#### Additional Information\n- **Company Overview:** Ellah Lakes Plc is a Nigerian agribusiness specializing in the cultivation of oil palm, cassava, and soybean. The company is expanding its operations in Edo, Enugu, and Ondo States and was listed on the Nigerian Stock Exchange on January 14, 1993. It aims to empower local communities and diversify its agricultural value chains.\n\n#### Conclusion\nThis disclosure highlights a strategic move by Ellah Lakes Plc to enhance agricultural productivity through the management of Adarice Farms, with a clear vision for future growth and community impact. The document is signed by OAKE Legal, the Company Secretary. \n\nFor further details, the companyâ€™s website is provided: www.ellahlakes.com."
}