{
  "doc_id": "39437_ELLAH_LAKES_PLC.-ELLAH_LAKES_PLC_-_RESIGNATION_OF_HAUWA_NURU_CORPORATE_ACTIONS_SEPTEMBER_2023",
  "source_file": "C:\\Users\\umair\\Desktop\\Financial Rag\\dataset\\Corporate_Disclosures\\39437_ELLAH_LAKES_PLC.-ELLAH_LAKES_PLC_-_RESIGNATION_OF_HAUWA_NURU_CORPORATE_ACTIONS_SEPTEMBER_2023.pdf",
  "title": "Notice of resignation of a director",
  "doc_type": "director_resignation",
  "disclosure_date": "2023-09-20",
  "year": 2023,
  "company_name": "Ellah Lakes Plc",
  "rc_number": "34296",
  "head_office_address": "No. 12 Ihama Road, G.R.A, Benin City, Edo State",
  "website": "www.ellahlakes.com",
  "meeting_type": null,
  "meeting_date": null,
  "meeting_time": null,
  "meeting_location": null,
  "agenda_items": [],
  "register_closure_start": null,
  "register_closure_end": null,
  "closed_period_start": null,
  "closed_period_end": null,
  "directors_as_listed": [
    "Olumide Akpata",
    "Chuka Mordi",
    "Shehu Abubakar",
    "Osaro Oyegun",
    "Evans Jakpa-Johns",
    "Maxwell Oko",
    "Nnenna Onyewuchi",
    "Enotie Ogbebor",
    "Chijioke Dozie",
    "Hauwa Nuru",
    "Joe Attueyi",
    "Charles Anajemba"
  ],
  "key_people_events": [
    {
      "name": "Hauwa Nuru",
      "event": "resignation",
      "role": "Director",
      "effective_date": "2023-09-19"
    }
  ],
  "company_secretary": "OAKE Legal",
  "signatory_name": "Olumoroti Alli",
  "event_category": "resignation",
  "transaction_type": null,
  "transaction_amount": null,
  "currency": null,
  "counterparties": [],
  "regulatory_bodies": [],
  "regulatory_references": [],
  "pages": [
    1
  ],
  "citation_file": null,
  "detailed_summary": "### Summary of Corporate Disclosure Document\n\n#### Purpose and Nature of the Disclosure\nThis document serves as a formal announcement regarding the resignation of a director from Ellah Lakes Plc. It provides essential details about the resignation and the subsequent actions the company will undertake.\n\n#### Key Dates\n- **Resignation Date**: Hauwa Nuru resigned effective September 19, 2023.\n- **Announcement Date**: The resignation was publicly announced on September 20, 2023.\n\n#### Director Information\n- **Resigning Director**: Hauwa Nuru\n  - **New Position**: Honourable Commissioner for Finance of Kwara State.\n  \n#### Company Information\n- **Company Name**: Ellah Lakes Plc\n- **Head Office Address**: No. 12 Ihama Road, G.R.A, Benin City, Edo State\n- **Registration Number**: RC No: 34296\n- **Website**: www.ellahlakes.com\n- **Contact Email**: info@ellahlakes.com\n\n#### Board of Directors\nThe document lists the current members of the Board of Directors:\n- Olumide Akpata\n- Chuka Mordi\n- Shehu Abubakar\n- Osaro Oyegun\n- Evans Jakpa-Johns\n- Maxwell Oko\n- Nnenna Onyewuchi\n- Enotie Ogbebor\n- Chijioke Dozie\n- Hauwa Nuru (resigned)\n- Joe Attueyi\n- Charles Anajemba\n\n#### Acknowledgment\nThe Board and management express gratitude to Hauwa Nuru for her service to the company.\n\n#### Future Actions\n- The company has initiated the process to fill the vacancy left by Hauwa Nuru's resignation.\n- Further communication will be provided once the Board confirms a replacement.\n\n#### Signatory\n- **Signed by**: Olumoroti Alli\n- **Position**: Company Secretary, OAKE Legal\n\nThis summary encapsulates all significant information from the corporate disclosure document regarding the resignation of a director at Ellah Lakes Plc."
}