{
  "doc_id": "40120_ELLAH_LAKES_PLC.-RESOLUTIONS_PASSED_AT_AGM_HELD_ON_16_JANUARY_2024_CORPORATE_ACTIONS_JANUARY_2024",
  "source_file": "C:\\Users\\umair\\Desktop\\Financial Rag\\dataset\\Corporate_Disclosures\\40120_ELLAH_LAKES_PLC.-RESOLUTIONS_PASSED_AT_AGM_HELD_ON_16_JANUARY_2024_CORPORATE_ACTIONS_JANUARY_2024.pdf",
  "title": "Resolutions Passed at AGM Held on 16 January 2024",
  "doc_type": "agm_notice",
  "disclosure_date": "2024-01-18",
  "year": 2024,
  "company_name": "Ellah Lakes Plc",
  "rc_number": "34296",
  "head_office_address": "No. 12 Ihama Road, G.R.A, Benin City, Edo State",
  "website": "www.ellahlakes.com",
  "meeting_type": "agm",
  "meeting_date": "2024-01-16",
  "meeting_time": null,
  "meeting_location": "The Workstation, 7, Ibiyinka Olorunbe Close, Victoria Island, Lagos",
  "agenda_items": [
    "That the Company’s audited financial statements for the year ended 31 July 2023 together with the reports of the Directors, Auditors and Audit Committee be and are hereby received and accepted.",
    "That the re-election of Messrs. Chuka Mordi and Chijioke Dozie as directors, retiring by rotation and having offered themselves up for re-election be and is hereby approved.",
    "That Messrs. Olabode Akande & Co. be and are hereby appointed as the Auditor of the Company for the financial year ending 31 July 2024.",
    "That the board of directors of the Company be and are hereby authorised to fix the remuneration of the Auditors.",
    "The remuneration of the Managers of the Company was disclosed in line with Section 257 of the Companies & Allied Matters Act 2020.",
    "That the following persons be and hereby nominated as the Directors to serve on the Statutory Audit Committee: Ms. Osaro Oyegun; and Ms. Nnenna Onyewuchi.",
    "That the following persons be and are hereby elected as the shareholders’ representatives on the Statutory Audit Committee: Pastor Edokpayi Wilfred; Mr. Olugbosun Banji; and Mr. Ezechukwu Augustine Nnaemeka.",
    "That, the Board of Directors be and is hereby authorised to raise up to the sum of ₦5,000,000,000 (five billion Naira) by way of private placement, or any other equity issuance on such terms as may be approved by the Board subject to obtaining all relevant regulatory approvals.",
    "That all acts carried out by the Board of Directors and/or management of the Company in connection with the above be and is hereby approved and ratified.",
    "That the Board of Directors be and is hereby authorised to perform other acts, take steps or do all such other things as may be necessary for or incidental to giving effect to the spirit and intendments of the above resolutions, as they deem appropriate."
  ],
  "register_closure_start": null,
  "register_closure_end": null,
  "closed_period_start": null,
  "closed_period_end": null,
  "directors_as_listed": [
    "Olumide Akpata",
    "Chuka Mordi",
    "Shehu Abubakar",
    "Osaro Oyegun",
    "Evans Jakpa-Johns",
    "Maxwell Oko",
    "Nnenna Onyewuchi",
    "Enotie Ogbebor",
    "Chijioke Dozie",
    "Hauwa Nuru",
    "Joe Attueyi",
    "Charles Anajemba"
  ],
  "key_people_events": [
    {
      "name": "Chuka Mordi",
      "event": "appointment",
      "role": "Director",
      "effective_date": null
    },
    {
      "name": "Chijioke Dozie",
      "event": "appointment",
      "role": "Director",
      "effective_date": null
    },
    {
      "name": "Osaro Oyegun",
      "event": "appointment",
      "role": "Director",
      "effective_date": null
    },
    {
      "name": "Nnenna Onyewuchi",
      "event": "appointment",
      "role": "Director",
      "effective_date": null
    },
    {
      "name": "Pastor Edokpayi Wilfred",
      "event": "appointment",
      "role": "Shareholder Representative",
      "effective_date": null
    },
    {
      "name": "Mr. Olugbosun Banji",
      "event": "appointment",
      "role": "Shareholder Representative",
      "effective_date": null
    },
    {
      "name": "Mr. Ezechukwu Augustine Nnaemeka",
      "event": "appointment",
      "role": "Shareholder Representative",
      "effective_date": null
    }
  ],
  "company_secretary": "OAKE Legal",
  "signatory_name": null,
  "event_category": "governance",
  "transaction_type": "private_placement",
  "transaction_amount": 5000000000.0,
  "currency": "NGN",
  "counterparties": [
    "Olabode Akande & Co."
  ],
  "regulatory_bodies": [
    "Companies & Allied Matters Act 2020"
  ],
  "regulatory_references": [],
  "pages": [
    1,
    2
  ],
  "citation_file": null,
  "detailed_summary": "### Summary of Corporate Disclosure Document for Ellah Lakes Plc\n\n#### Purpose and Nature of the Disclosure\nThis document serves as the official record of the resolutions passed during the Annual General Meeting (AGM) of Ellah Lakes Plc, held on January 16, 2024. It outlines the decisions made regarding the company's financial statements, director elections, auditor appointments, and other corporate governance matters.\n\n#### Key Dates\n- **AGM Date:** January 16, 2024\n- **Financial Year Ended:** July 31, 2023\n- **Next Financial Year Ending:** July 31, 2024\n\n#### Company Information\n- **Company Name:** Ellah Lakes Plc\n- **Head Office Address:** No. 12 Ihama Road, G.R.A, Benin City, Edo State\n- **RC No:** 34296\n- **Website:** www.ellahlakes.com\n\n#### Directors Present\n- Olumide Akpata\n- Chuka Mordi\n- Shehu Abubakar\n- Osaro Oyegun\n- Evans Jakpa-Johns\n- Maxwell Oko\n- Nnenna Onyewuchi\n- Enotie Ogbebor\n- Chijioke Dozie\n- Hauwa Nuru\n- Joe Attueyi\n- Charles Anajemba\n\n#### Resolutions Passed\n1. **Acceptance of Financial Statements:**\n   - The audited financial statements for the year ended July 31, 2023, along with the reports from the Directors, Auditors, and Audit Committee, were received and accepted.\n\n2. **Re-election of Directors:**\n   - Messrs. Chuka Mordi and Chijioke Dozie were re-elected as directors, retiring by rotation.\n\n3. **Appointment of Auditors:**\n   - Messrs. Olabode Akande & Co. were appointed as the Auditor for the financial year ending July 31, 2024.\n\n4. **Auditor Remuneration:**\n   - The Board of Directors was authorized to fix the remuneration of the Auditors.\n\n5. **Disclosure of Managerial Remuneration:**\n   - The remuneration of the Managers of the Company was disclosed in accordance with Section 257 of the Companies & Allied Matters Act 2020.\n\n6. **Statutory Audit Committee Nominations:**\n   - The following individuals were nominated as Directors to serve on the Statutory Audit Committee:\n     - Ms. Osaro Oyegun\n     - Ms. Nnenna Onyewuchi\n\n7. **Shareholders’ Representatives on Audit Committee:**\n   - The following individuals were elected as shareholders’ representatives on the Statutory Audit Committee:\n     - Pastor Edokpayi Wilfred\n     - Mr. Olugbosun Banji\n     - Mr. Ezechukwu Augustine Nnaemeka\n\n8. **Authorization for Fundraising:**\n   - The Board of Directors was authorized to raise up to ₦5,000,000,000 (five billion Naira) through private placement or other equity issuance, subject to obtaining all relevant regulatory approvals.\n\n9. **Ratification of Board Actions:**\n   - All acts carried out by the Board of Directors and/or management in connection with the above resolutions were approved and ratified.\n\n10. **General Authorization:**\n    - The Board of Directors was authorized to perform other acts and take necessary steps to give effect to the resolutions.\n\n#### Compliance Matters\n- The document references compliance with Section 257 of the Companies & Allied Matters Act 2020 regarding the disclosure of managerial remuneration.\n\n#### Signatory\n- The document is signed by OAKE Legal, serving as the Company Secretary.\n\nThis summary encapsulates all significant details from the corporate disclosure document regarding the AGM of Ellah Lakes Plc, including resolutions, appointments, and compliance matters."
}