{
  "doc_id": "40531_ELLAH_LAKES_PLC.-_NOTICE_OF_BOARD_MEETING_(BM)",
  "source_file": "C:\\Users\\umair\\Desktop\\Financial Rag\\dataset\\Corporate_Disclosures\\40531_ELLAH_LAKES_PLC.-_NOTICE_OF_BOARD_MEETING_(BM).pdf",
  "title": "Notice of Board Meeting",
  "doc_type": "board_meeting_notice",
  "disclosure_date": "2024-03-15",
  "year": 2024,
  "company_name": "Ellah Lakes Plc",
  "rc_number": "34296",
  "head_office_address": "No. 12 Ihama Road, G.R.A, Benin City, Edo State",
  "website": "www.ellahlakes.com",
  "meeting_type": "board_meeting",
  "meeting_date": "2024-03-27",
  "meeting_time": "11:00",
  "meeting_location": "5th floor, AIICO Plaza, Plot PC 12, Churchgate Street, Victoria Island, Lagos",
  "agenda_items": [
    "consider the Company’s activities"
  ],
  "register_closure_start": null,
  "register_closure_end": null,
  "closed_period_start": null,
  "closed_period_end": null,
  "directors_as_listed": [
    "Chuka Mordi",
    "Osaro Oyegun",
    "Evans Jakpa-Johns",
    "Maxwell Oko",
    "Nnenna Onyewuchi",
    "Enotie Ogbebor",
    "Chijioke Dozie",
    "Joe Attueyi",
    "Charles Anajemba"
  ],
  "key_people_events": [],
  "company_secretary": "OAKE Legal",
  "signatory_name": null,
  "event_category": "meeting",
  "transaction_type": null,
  "transaction_amount": null,
  "currency": null,
  "counterparties": [],
  "regulatory_bodies": [],
  "regulatory_references": [],
  "pages": [
    1
  ],
  "citation_file": null,
  "detailed_summary": "### Summary of Corporate Disclosure Document\n\n#### Purpose and Nature of the Disclosure\nThe document serves as a formal notice for a scheduled meeting of the Board of Directors of Ellah Lakes Plc. It outlines the date, time, and location of the meeting, as well as the agenda to consider the Company's activities.\n\n#### Key Dates\n- **Date of Notice**: 15 March 2024\n- **Date of Board Meeting**: 27 March 2024\n- **Time of Meeting**: 11:00 AM\n\n#### Location of the Meeting\n- **Venue**: 5th floor, AIICO Plaza, Plot PC 12, Churchgate Street, Victoria Island, Lagos\n\n#### Board of Directors\nThe following individuals are listed as directors of Ellah Lakes Plc:\n- Chuka Mordi\n- Osaro Oyegun\n- Evans Jakpa-Johns\n- Maxwell Oko\n- Nnenna Onyewuchi\n- Enotie Ogbebor\n- Chijioke Dozie\n- Joe Attueyi\n- Charles Anajemba\n\n#### Company Information\n- **Company Name**: Ellah Lakes Plc\n- **Head Office Address**: No. 12 Ihama Road, G.R.A, Benin City, Edo State\n- **Registration Number**: RC No: 34296\n- **Website**: www.ellahlakes.com\n- **Email**: info@ellahlakes.com\n\n#### Company Secretary\n- **Name**: OAKE Legal\n\n#### Agenda Items\nThe primary agenda item for the meeting is to consider the Company’s activities. Specific details regarding other matters to be discussed are not provided in the document.\n\n#### Regulatory Requirements\nThe notice complies with corporate governance requirements for notifying board members of meetings, ensuring transparency and adherence to regulatory standards.\n\n#### Conclusion\nThis document serves as an official communication to the Board of Directors of Ellah Lakes Plc regarding an upcoming meeting, detailing essential information such as the date, time, location, and agenda."
}