{
  "doc_id": "40857_ELLAH_LAKES_PLC.-ELLAH_LAKES_PLC_-_NOTICE_OF_CHANGES_TO_THE_BOARD_CORPORATE_ACTIONS_APRIL_2024",
  "source_file": "C:\\Users\\umair\\Desktop\\Financial Rag\\dataset\\Corporate_Disclosures\\40857_ELLAH_LAKES_PLC.-ELLAH_LAKES_PLC_-_NOTICE_OF_CHANGES_TO_THE_BOARD_CORPORATE_ACTIONS_APRIL_2024.pdf",
  "title": "Notice of changes to the Board",
  "doc_type": "corporate_action",
  "disclosure_date": "2024-04-05",
  "year": 2024,
  "company_name": "Ellah Lakes Plc",
  "rc_number": "34296",
  "head_office_address": "No. 12 Ihama Road, G.R.A, Benin City, Edo State",
  "website": "www.ellahlakes.com",
  "meeting_type": null,
  "meeting_date": null,
  "meeting_time": null,
  "meeting_location": null,
  "agenda_items": [],
  "register_closure_start": null,
  "register_closure_end": null,
  "closed_period_start": null,
  "closed_period_end": null,
  "directors_as_listed": [
    "Chuka Mordi",
    "Shehu Abubakar",
    "Osaro Oyegun",
    "Evans Jakpa-Johns",
    "Maxwell Oko",
    "Nnenna Onyewuchi",
    "Enotie Ogbebor",
    "Chijioke Dozie",
    "Joe Attueyi",
    "Charles Anajemba"
  ],
  "key_people_events": [
    {
      "name": "Emmanuel Jakpa",
      "event": "appointment",
      "role": "Director",
      "effective_date": null
    },
    {
      "name": "Joe Attueyi",
      "event": "appointment",
      "role": "Chairman",
      "effective_date": null
    },
    {
      "name": "Olumide Akpata",
      "event": "resignation",
      "role": "Chairman",
      "effective_date": null
    }
  ],
  "company_secretary": "OAKE Legal",
  "signatory_name": null,
  "event_category": "appointment",
  "transaction_type": null,
  "transaction_amount": null,
  "currency": null,
  "counterparties": [
    "BlackRock Law Chambers",
    "Kalm Marine & Petroleum Services Limited"
  ],
  "regulatory_bodies": [
    "Nigerian Exchange Limited"
  ],
  "regulatory_references": [],
  "pages": [
    1
  ],
  "citation_file": null,
  "detailed_summary": "### Summary of Corporate Disclosure Document for Ellah Lakes Plc\n\n#### Purpose and Nature of the Disclosure\nThe document serves as a formal notification to the Nigerian Exchange Limited and the investing public regarding recent changes to the Board of Directors of Ellah Lakes Plc. It outlines the appointment of a new director and the election of a new chairman following recent retirements and resignations.\n\n#### Key Dates\n- **Date of Disclosure:** 5 April 2024\n- **Date of Appointment of New Chairman:** Following the resignation of the previous chairman, specific date not provided.\n- **Date of Appointment of Mr. Emmanuel Jakpa:** Subject to ratification at the next annual general meeting (exact date of the meeting not specified).\n\n#### Board of Directors\n- **Current Directors:**\n  - Chuka Mordi\n  - Shehu Abubakar\n  - Osaro Oyegun\n  - Evans Jakpa-Johns\n  - Maxwell Oko\n  - Nnenna Onyewuchi\n  - Enotie Ogbebor\n  - Chijioke Dozie\n  - Joe Attueyi (newly elected chairman)\n  - Charles Anajemba\n\n#### Key Appointments\n- **New Director:** \n  - **Name:** Mr. Emmanuel Jakpa\n  - **Role:** Director (subject to shareholder ratification at the next annual general meeting)\n  - **Background:** Principal Partner at BlackRock Law Chambers, legal practitioner with over 20 years of experience in Corporate, Commercial, & Litigation law, particularly in the Maritime & Oil & Gas sectors. Current Chairman of Warri Economic Summit Group and Director at Kalm Marine & Petroleum Services Limited. Holds an LLB from the University of Benin and a BL from the Nigerian Law School.\n\n- **New Chairman:**\n  - **Name:** Mr. Joe Attueyi\n  - **Role:** Chairman of the Board\n  - **Background:** Appointed to the Board on 27 September 2018, recognized for his invaluable contributions to the Company.\n\n#### Resignations\n- **Previous Chairman:** Mr. Olumide Akpata has resigned from his position.\n\n#### Company Information\n- **Company Name:** Ellah Lakes Plc\n- **Head Office Address:** No. 12 Ihama Road, G.R.A, Benin City, Edo State\n- **RC No:** 34296\n- **Website:** www.ellahlakes.com\n- **Email:** info@ellahlakes.com\n\n#### Conclusion\nThe Board of Ellah Lakes Plc expresses confidence in Mr. Emmanuel Jakpa's skills and experience to contribute to the Company's growth and success. The changes in the Board's composition are part of the Company's ongoing governance and strategic development efforts. \n\n#### Signatory\n- **Signed by:** OAKE Legal (Company Secretary) for Ellah Lakes Plc."
}