{
  "doc_id": "41166_ELLAH_LAKES_PLC.-NOTICE_OF_CLOSED_PERIOD_CORPORATE_ACTIONS_MAY_2024",
  "source_file": "C:\\Users\\umair\\Desktop\\Financial Rag\\dataset\\Corporate_Disclosures\\41166_ELLAH_LAKES_PLC.-NOTICE_OF_CLOSED_PERIOD_CORPORATE_ACTIONS_MAY_2024.pdf",
  "title": "Notice of Closed Period for Trading in Ellah Lakes Plc Shares",
  "doc_type": "regulatory_notice",
  "disclosure_date": "2024-05-02",
  "year": 2024,
  "company_name": "Ellah Lakes Plc",
  "rc_number": null,
  "head_office_address": "No. 12 Ihama Road, G.R.A, Benin City, Edo State",
  "website": "www.ellahlakes.com",
  "meeting_type": null,
  "meeting_date": null,
  "meeting_time": null,
  "meeting_location": null,
  "agenda_items": [],
  "register_closure_start": "2024-05-01",
  "register_closure_end": null,
  "closed_period_start": "2024-05-01",
  "closed_period_end": null,
  "directors_as_listed": [
    "Chuka Mordi",
    "Osaro Oyegun",
    "Evans Jakpa-Johns",
    "Maxwell Oko",
    "Nnenna Onyewuchi",
    "Enotie Ogbebor",
    "Chijioke Dozie",
    "Joe Attueyi",
    "Charles Anajemba"
  ],
  "key_people_events": [],
  "company_secretary": "OAKE Legal",
  "signatory_name": null,
  "event_category": "governance",
  "transaction_type": null,
  "transaction_amount": null,
  "currency": null,
  "counterparties": [],
  "regulatory_bodies": [
    "Nigerian Exchange Limited"
  ],
  "regulatory_references": [
    "Rule 17.18"
  ],
  "pages": [
    1
  ],
  "citation_file": null,
  "detailed_summary": "### Summary of Corporate Disclosure Document for Ellah Lakes Plc\n\n#### Purpose and Nature of the Disclosure\nThe document serves as a formal notification to the Nigerian Exchange Limited (NGX) and the investing public regarding the initiation of a closed trading period for Ellah Lakes Plc. This disclosure is made in compliance with Rule 17.18 of the Issuers’ Rules, which governs insider trading policies.\n\n#### Key Dates\n- **Closed Period Commencement**: 1st May 2024\n- **Expected Duration**: The closed period will last until twenty-four (24) hours after the release of the Unaudited Financial Statements for the period ended 30th April 2024.\n\n#### Important Details\n- **Company Name**: Ellah Lakes Plc\n- **Head Office Address**: No. 12 Ihama Road, G.R.A, Benin City, Edo State\n- **Website**: www.ellahlakes.com\n\n#### Directors of Ellah Lakes Plc\nThe following individuals are listed as directors of the company:\n- Chuka Mordi\n- Osaro Oyegun\n- Evans Jakpa-Johns\n- Maxwell Oko\n- Nnenna Onyewuchi\n- Enotie Ogbebor\n- Chijioke Dozie\n- Joe Attueyi\n- Charles Anajemba\n\n#### Regulatory Compliance\nThe closed period is established in accordance with the Company’s Insider Trading Policy, which prohibits insiders from trading the company's securities during this timeframe.\n\n#### Signatory\nThe disclosure is signed by OAKE Legal, who serves as the Company Secretary for Ellah Lakes Plc.\n\nThis summary encapsulates all significant information from the corporate disclosure document, including the purpose, key dates, company details, director names, regulatory compliance, and the signatory."
}