{
  "doc_id": "Ellah_Lakes_Plc_-_CBO_Capital_Cross_Deal",
  "source_file": "C:\\Users\\umair\\Desktop\\Financial Rag\\dataset\\Corporate_Disclosures\\Ellah_Lakes_Plc_-_CBO_Capital_Cross_Deal.pdf",
  "title": "CBO Capital Partners Ltd Transfers Ellah Lakes Plc Shares to Shareholders/Creditors in Cross Deal",
  "doc_type": "corporate_action",
  "disclosure_date": "2024-07-02",
  "year": 2024,
  "company_name": "Ellah Lakes Plc",
  "rc_number": null,
  "head_office_address": "No. 10 Muritala Mohammed Way, Benin City, Edo State",
  "website": "www.ellahlakes.com",
  "meeting_type": null,
  "meeting_date": null,
  "meeting_time": null,
  "meeting_location": null,
  "agenda_items": [],
  "register_closure_start": null,
  "register_closure_end": null,
  "closed_period_start": null,
  "closed_period_end": null,
  "directors_as_listed": [
    "Chuka Mordi (MD)",
    "Joe Attueyi",
    "Osaro Oyegun",
    "Evans Jakpa-Johns",
    "Maxwell Oko",
    "Nnenna Onyewuchi",
    "Enotie Ogbebor",
    "Chijioke Dozie",
    "Emmanuel Jakpa",
    "Charles Anajemba"
  ],
  "key_people_events": [
    {
      "name": "Chuka Mordi",
      "event": "announcement_subject",
      "role": "CEO",
      "effective_date": null
    },
    {
      "name": "Modupe Boardman Ejikeme",
      "event": "continuing",
      "role": "Head of Administration",
      "effective_date": null
    }
  ],
  "company_secretary": null,
  "signatory_name": "Modupe Boardman Ejikeme",
  "event_category": "governance",
  "transaction_type": "cross_deal",
  "transaction_amount": null,
  "currency": null,
  "counterparties": [
    "CBO Capital Partners Limited"
  ],
  "regulatory_bodies": [
    "Nigerian Exchange Limited"
  ],
  "regulatory_references": [],
  "pages": [
    1
  ],
  "citation_file": null,
  "detailed_summary": "### Summary of Corporate Disclosure Document for Ellah Lakes Plc.\n\n#### Purpose and Nature of the Disclosure\nThe document serves as a corporate disclosure regarding the transfer of shares by CBO Capital Partners Limited (CBO), a major shareholder of Ellah Lakes Plc. This transfer is aimed at fulfilling the free float requirements set by the Nigerian Exchange Limited (NGX) and managing CBO's outstanding obligations to its shareholders and creditors.\n\n#### Key Dates\n- **Disclosure Date:** July 02, 2024\n- **NSE Listing Date:** January 14, 1993\n\n#### Key Individuals\n- **Chuka Mordi:** CEO of Ellah Lakes Plc.\n- **Modupe Boardman Ejikeme:** Head of Administration at Ellah Lakes Plc.\n- **Directors of Ellah Lakes Plc:** \n  - Joe Attueyi\n  - Osaro Oyegun\n  - Evans Jakpa-Johns\n  - Maxwell Oko\n  - Nnenna Onyewuchi\n  - Enotie Ogbebor\n  - Chijioke Dozie\n  - Emmanuel Jakpa\n  - Charles Anajemba\n\n#### Companies and Organizations Referenced\n- **Ellah Lakes Plc:** The company making the disclosure, involved in agribusiness.\n- **CBO Capital Partners Limited:** Major shareholder transferring shares.\n- **Nigerian Exchange Limited (NGX):** Regulatory body setting the free float requirements.\n\n#### Specific Transactions and Events\n- CBO is transferring a portion of its shares in Ellah Lakes Plc to its shareholders and creditors in a cross deal. This action is intended to:\n  - Offset CBO's outstanding obligations.\n  - Fulfill NGX's requirements for the free float of Ellah Lakes shares.\n  \n#### Resolutions and Action Points\n- The transfer of shares is a strategic move by CBO to enhance the liquidity and free float of Ellah Lakes shares in the market.\n- CBO aims to demonstrate financial responsibility and compliance with regulatory standards through this transaction.\n\n#### Regulatory Requirements and Compliance Matters\n- The transaction is in compliance with the free float requirements mandated by the Nigerian Exchange Limited (NGX).\n\n#### Additional Information\n- **Business Focus:** Ellah Lakes Plc specializes in the cultivation of Oil Palm, Cassava, and Soya beans, with operations in Edo, Enugu, and Ondo States. The company is diversifying into other agricultural value chains, including Maize and Rice.\n- **Community Impact:** Ellah Lakes Plc has a history of empowering the communities in which it operates.\n\n#### Conclusion\nThe disclosure highlights a significant corporate action by CBO Capital Partners Limited that not only addresses its financial obligations but also aligns with regulatory requirements, thereby supporting the overall stability and growth of Ellah Lakes Plc. For further information, stakeholders are encouraged to visit the companyâ€™s website at www.ellahlakes.com."
}