{
  "doc_id": "Ellah_20Lakes-_20Announcement_20to_20the_20NSE_20on_20appointment_20of_20MD",
  "source_file": "C:\\Users\\umair\\Desktop\\Financial Rag\\dataset\\Corporate_Disclosures\\Ellah_20Lakes-_20Announcement_20to_20the_20NSE_20on_20appointment_20of_20MD.pdf",
  "title": "Ellah Lakes Plc appoints new Managing Director",
  "doc_type": "director_appointment",
  "disclosure_date": "2019-06-13",
  "year": 2019,
  "company_name": "Ellah Lakes Plc",
  "rc_number": null,
  "head_office_address": null,
  "website": "www.ellahlakes.com",
  "meeting_type": "board_meeting",
  "meeting_date": "2019-06-12",
  "meeting_time": null,
  "meeting_location": null,
  "agenda_items": [],
  "register_closure_start": null,
  "register_closure_end": null,
  "closed_period_start": null,
  "closed_period_end": null,
  "directors_as_listed": [
    "Gen. Z. Lekwot (Rtd)",
    "Mr. Frank Ellah",
    "Dr. Chiamaka Cookey-Gam",
    "Mr. Chukwuka Mordi",
    "Mr. Enotie Ogbebor",
    "Ms. Osaro Oyegun"
  ],
  "key_people_events": [
    {
      "name": "Mr. Chuka Mordi",
      "event": "appointment",
      "role": "Managing Director",
      "effective_date": "2019-06-12"
    },
    {
      "name": "Mr. Frank Ellah",
      "event": "continuing",
      "role": "null",
      "effective_date": null
    }
  ],
  "company_secretary": "Kenechi Ezezika",
  "signatory_name": "Kenechi Ezezika",
  "event_category": "appointment",
  "transaction_type": null,
  "transaction_amount": null,
  "currency": null,
  "counterparties": [
    "Telluria Limited",
    "CBO Investment Management"
  ],
  "regulatory_bodies": [],
  "regulatory_references": [],
  "pages": [
    1,
    2
  ],
  "citation_file": null,
  "detailed_summary": "# Summary of Corporate Disclosure Document for Ellah Lakes Plc\n\n## Purpose and Nature of the Disclosure\nThe document serves to announce the appointment of a new Managing Director for Ellah Lakes Plc and details a significant business combination with Telluria Limited aimed at enhancing the company's operations and financial standing.\n\n## Key Dates\n- **Appointment Date**: June 12, 2019\n- **Announcement Date**: June 13, 2019\n- **Incorporation Date of Ellah Lakes Plc**: July 2, 1980\n- **Listing Date on Nigerian Stock Exchange**: January 14, 1993\n\n## Key Personnel\n- **Mr. Chuka Mordi**: Appointed as Managing Director of Ellah Lakes Plc, effective June 12, 2019. He succeeds Mr. Frank Ellah.\n- **Mr. Frank Ellah**: Former Managing Director, transitioning to new pursuits.\n- **Directors of Ellah Lakes Plc**: \n  - Gen. Z. Lekwot (Rtd)\n  - Mr. Frank Ellah\n  - Dr. Chiamaka Cookey-Gam\n  - Mr. Chukwuka Mordi\n  - Mr. Enotie Ogbebor\n  - Ms. Osaro Oyegun\n- **Kenechi Ezezika**: Company Secretary, representing OAKE Legal.\n\n## Companies and Organizations Referenced\n- **Ellah Lakes Plc**: The company making the disclosure.\n- **Telluria Limited**: The company with which Ellah Lakes is entering a business combination.\n- **CBO Investment Management**: The firm where Mr. Mordi was Managing Partner prior to his appointment.\n- **SBC Warburg, Hardman & Co. Ltd, InterSec Research Corp, Societe Generale Asset Management (SGAM)**: Previous employers of Mr. Mordi.\n\n## Specific Transactions and Events\n- **Business Combination**: Ellah Lakes Plc has agreed to a business combination with Telluria Limited. This strategic move is intended to:\n  - Strengthen Ellah Lakesâ€™ balance sheet.\n  - Restore customer confidence.\n  - Provide access to new markets.\n  - Enhance operations to drive profitability and deliver shareholder value.\n\n## Resolutions and Action Points\n- The board of Ellah Lakes Plc convened on June 12, 2019, to approve the appointment of Mr. Mordi and the business combination with Telluria Limited.\n\n## Regulatory Requirements and Compliance Matters\n- The document does not specify any particular regulatory requirements or compliance matters beyond the standard corporate governance practices associated with board appointments and business combinations.\n\n## Additional Information\n- **Mr. Mordi's Background**: He has over 25 years of experience in finance, including private equity investing, investment banking, and investment research. He has held various significant roles and has a strong educational background with a Philosophy degree from King's College, University of London.\n- **Ellah Lakes Plc's Business Focus**: The company specializes in agriculture, particularly fish farming, and aims to diversify its product offerings through the acquisition of Telluria.\n\n## Conclusion\nThis disclosure outlines a pivotal leadership change and strategic business move for Ellah Lakes Plc, positioning the company for future growth and enhanced market presence. For further details about the company and its initiatives, the document directs readers to visit the official website: www.ellahlakes.com."
}