{
  "doc_id": "Ellah_20Lakes-_20Resignation_20of_20CFO",
  "source_file": "C:\\Users\\umair\\Desktop\\Financial Rag\\dataset\\Corporate_Disclosures\\Ellah_20Lakes-_20Resignation_20of_20CFO.pdf",
  "title": "Resignation of the Chief Financial Officer of Ellah Lakes Plc",
  "doc_type": "director_resignation",
  "disclosure_date": "2019-09-09",
  "year": 2019,
  "company_name": "Ellah Lakes Plc",
  "rc_number": null,
  "head_office_address": "No. 12 Ihama Road, G.R.A, Benin City, Edo State",
  "website": "www.ellahlakes.com",
  "meeting_type": null,
  "meeting_date": null,
  "meeting_time": null,
  "meeting_location": null,
  "agenda_items": [],
  "register_closure_start": null,
  "register_closure_end": null,
  "closed_period_start": null,
  "closed_period_end": null,
  "directors_as_listed": [
    "General  Z Lekwot (Rtd.)",
    "Mr. Frank Ellah",
    "Mr. Chuka Mordi",
    "Mr. Joe Attueyi",
    "Mr. Enotie Ogbebor",
    "Ms. Osaro Oyegun"
  ],
  "key_people_events": [
    {
      "name": "Mr. Wole Onasanya",
      "event": "resignation",
      "role": "Chief Financial Officer",
      "effective_date": null
    }
  ],
  "company_secretary": "OAKE Legal",
  "signatory_name": "Kenechi Ezezika",
  "event_category": "resignation",
  "transaction_type": null,
  "transaction_amount": null,
  "currency": null,
  "counterparties": [],
  "regulatory_bodies": [],
  "regulatory_references": [],
  "pages": [
    1
  ],
  "citation_file": null,
  "detailed_summary": "### Summary of Corporate Disclosure Document\n\n#### Purpose and Nature of the Disclosure\nThe document serves as a formal announcement regarding the resignation of Mr. Wole Onasanya from his position as Chief Financial Officer (CFO) of Ellah Lakes Plc. It outlines the reasons for his departure and expresses gratitude for his service.\n\n#### Key Dates\n- **Resignation Announcement Date**: September 9, 2019\n- **Company Incorporation Date**: July 2, 1980\n- **Listing on Nigerian Stock Exchange**: January 14, 1993\n\n#### Key Individuals\n- **Mr. Wole Onasanya**: Resigned as Chief Financial Officer of Ellah Lakes Plc.\n- **Kenechi Ezezika**: Company Secretary, signed the announcement.\n- **Board of Directors**: Includes General Z Lekwot (Rtd.), Mr. Frank Ellah, Mr. Chuka Mordi, Mr. Joe Attueyi, Mr. Enotie Ogbebor, and Ms. Osaro Oyegun.\n\n#### Company Information\n- **Name**: Ellah Lakes Plc\n- **Nature of Business**: Agriculture, specializing in Oil Palm plantations.\n- **Operational Regions**: Edo and Delta States, Nigeria.\n- **Website**: www.ellahlakes.com\n\n#### Resignation Details\n- **Reason for Resignation**: Mr. Onasanya resigned to pursue other opportunities within the Nigerian Financial Services sector.\n- **Acknowledgment**: The board of directors expressed gratitude for Mr. Onasanya's service and wished him well in his future endeavors.\n- **Future Announcement**: The company will announce the appointment of a new CFO in due course.\n\n#### Regulatory and Compliance Matters\n- The document does not specify any regulatory requirements or compliance matters directly related to the resignation but indicates that the company will follow proper procedures in appointing a new CFO.\n\n#### Additional Information\n- **Company's Mission**: Ellah Lakes Plc aims to empower the communities in which it operates and is diversifying across the Oil Palm value chain.\n\nThis summary encapsulates all significant information from the corporate disclosure document regarding the resignation of the CFO and provides a clear overview of the company's background and future intentions."
}