{
  "doc_id": "Ellah_20Lakes-_20Announcement_20on_20acquisition_20of_20Telluria_20Limited",
  "source_file": "C:\\Users\\umair\\Desktop\\Financial Rag\\dataset\\Corporate_Disclosures\\Ellah_20Lakes-_20Announcement_20on_20acquisition_20of_20Telluria_20Limited.pdf",
  "title": "Ellah Lakes Plc Acquisition of Telluria Limited",
  "doc_type": "acquisition",
  "disclosure_date": "2019-06-13",
  "year": 2019,
  "company_name": "Ellah Lakes Plc",
  "rc_number": null,
  "head_office_address": null,
  "website": "www.ellahlakes.com",
  "meeting_type": null,
  "meeting_date": null,
  "meeting_time": null,
  "meeting_location": null,
  "agenda_items": [],
  "register_closure_start": null,
  "register_closure_end": null,
  "closed_period_start": null,
  "closed_period_end": null,
  "directors_as_listed": [],
  "key_people_events": [
    {
      "name": "Kenechi Ezezika",
      "event": "announcement_subject",
      "role": "Company Secretary",
      "effective_date": null
    }
  ],
  "company_secretary": "OAKE Legal",
  "signatory_name": "Kenechi Ezezika",
  "event_category": "acquisition",
  "transaction_type": null,
  "transaction_amount": null,
  "currency": null,
  "counterparties": [
    "Telluria Limited"
  ],
  "regulatory_bodies": [
    "Nigerian Stock Exchange",
    "Securities and Exchange Commission"
  ],
  "regulatory_references": [],
  "pages": [
    1
  ],
  "citation_file": null,
  "detailed_summary": "### Summary of Corporate Disclosure Document\n\n#### Purpose and Nature of the Disclosure\nThe document is a corporate disclosure announcement from Ellah Lakes Plc regarding the acquisition of Telluria Limited. The announcement serves to inform stakeholders about the acquisition's completion and its strategic significance for the company.\n\n#### Key Dates\n- **Acquisition Announcement Date:** June 13th, 2019\n- **Effective Date of Acquisition:** May 7th, 2019\n- **Incorporation Date of Ellah Lakes Plc:** July 2nd, 1980\n- **Listing Date on Nigerian Stock Exchange:** January 14th, 1993\n\n#### Acquisition Details\n- **Acquired Entity:** Telluria Limited\n- **Equity Stake Acquired:** 100%\n- **Regulatory Approvals:** The acquisition received approval from the Nigerian Stock Exchange and the Securities and Exchange Commission.\n\n#### Objectives of the Acquisition\nThe primary objectives of acquiring Telluria Limited include:\n- Strengthening Ellah Lakes' balance sheet\n- Restoring customer confidence\n- Providing access to new markets\n- Improving operations\n- Creating organizational efficiencies to drive profitability and increase shareholder value\n\n#### Expected Outcomes\nThe Board of Directors and Management of Ellah Lakes anticipate that the acquisition will:\n- Revitalize management\n- Create access to diversified expertise and financial strength\n- Improve administrative and operational efficiencies\n- Strengthen the companyâ€™s market position by facilitating access to new products and markets\n\n#### Company Information\n- **Company Name:** Ellah Lakes Plc\n- **Business Focus:** Agriculture, specializing in Fish Farming\n- **Website:** www.ellahlakes.com\n\n#### Contact Information\n- **Company Secretary:** Kenechi Ezezika\n- **Legal Representation:** OAKE Legal\n\nThis summary encapsulates all significant information from the corporate disclosure document regarding the acquisition of Telluria Limited by Ellah Lakes Plc."
}